<?xml version="1.0" encoding="UTF-8"?>
<tns:collection xmlns:tns="http://www.example.org/t1/"
 xmlns:xsi="http://www.w3.org/2001/XMLSchema-instance"
 xsi:schemaLocation="http://www.example.org/t1/ t1.xsd">
    <tns:t1 id="id0">
        <a1>Hello</a1>
        <b1>Hale</b1>
        <c1>World</c1>
    </tns:t1>
    <tns:t1 id="id1">
        <a1>World</a1>
        <b1>Hello</b1>
        <c1>Hale</c1>
    </tns:t1>
</tns:collection>
