<?xml version="1.0" encoding="UTF-8"?>
<tns:collection xmlns:tns="http://www.example.org/t1/"
 xmlns:xsi="http://www.w3.org/2001/XMLSchema-instance"
 xsi:schemaLocation="http://www.example.org/t1/ t1.xsd">
    <tns:t1>
        <a1>a</a1>
        <b1>b</b1>
        <c1>c_1</c1>
        <c1>c_2</c1>
        <c1>c_3</c1>
        <c1>c_4</c1>
        <c1>c_5</c1>
    </tns:t1>
</tns:collection>
