<?xml version="1.0" encoding="UTF-8"?>
<tns:collection xmlns:tns="http://www.example.org/t1/"
 xmlns:xsi="http://www.w3.org/2001/XMLSchema-instance"
 xsi:schemaLocation="http://www.example.org/t1/ t1.xsd">
    <tns:t1 id="id0">
        <a1>1</a1>
        <b1>b10</b1>
        <c1>6</c1>
    </tns:t1>
    <tns:t1 id="id1">
        <a1>5</a1>
        <b1>b10</b1>
        <c1>4</c1>
    </tns:t1>
</tns:collection>
